[
  {
    "id": "fae-ciencia-de-dados",
    "org": "FAE",
    "role": {
      "pt": "Graduação em Ciência de Dados",
      "en": "Bachelor's degree in Data Science"
    },
    "start": "2023-02",
    "end": null,
    "place": null,
    "summary": {
      "pt": null,
      "en": null
    },
    "bullets": {
      "pt": [],
      "en": []
    },
    "draft": false
  }
]
