[
  {
    "id": "grupo-soma-bi",
    "org": "Grupo SOMA",
    "role": {
      "pt": "Analista de BI",
      "en": "BI Analyst"
    },
    "start": "2023",
    "end": null,
    "place": null,
    "summary": {
      "pt": null,
      "en": null
    },
    "bullets": {
      "pt": [],
      "en": []
    },
    "draft": false
  }
]
